0,lassoguillermo acá debió ser algo igualpero no con el prepotenteno entiendo como fue que nos ín vadio es 
1,vamossiec lenin quitomilenario vecinomario carlospaezperez augustobarrerag vamoslenin ximeponceleon 
1,desde cedhu exigimos a lenin no sólo que se apruebe la ley para prevenir y erradicar la violencia de género sino 
1,rocío gonzález de moreno realizó un agasajo navideño en hospital del niño 
1,mashirafael la verdad los tiempos duros ya pasaron usted ya no es presidente gracias a dios el pais esta mejorando
1,revolucionpais lenin sandinin reychris florcisparedes nandorevolucion julietmaryg apereznena elregioec 
0,bellhermosa mauriciorodasec emaseo quitolibertario recuperemosuio ecuadorrc luiscncejal soledadbenitezq 
0,reychris lenin el problema es que ya no tenemos gobierno
1,fabrimred lenin lourdestorres abenitesd alexmoramoya andypais eliastenoriom innovacionec 
1,y cobra doble sueldo del estado lenin una como concejal y el latisueldo como periodista q no lo es 
1,hola me ayudas a compartir la siguiente imagen diana es mi prima y está perdida desde ayer uio lenin 
1,el presidente lenin realizará importantes anuncios el miércoles enero de con relación a empleo para los jóvenes del país
1,mauriciorodasec lenin el proceder del metropolitano fué el correcto 
1,sencillamente lamentable vuelve la mano negra y su pálido reflejo señor lenin mcarvajala detengan esta persecu 
1,micheldoumet pais lenin queridos militantes de ap nunca olviden esas caras esos son los rostros de los judas 
0,para los sorprendidos estás también eran las prácticas del gobierno de la revolución ciudadana 
1,mashirafael feliz presidente lo mejor de este mundo para udy su familia
0,augustobarrerag valores que el gobierno de lenin está destrozando no es cuestión de palabrería sino de actuar de acuerdo a esos valores
0,nadie como rafael correa http 
1,jimmyjairala razones para decir nono a la consulta mañosano a los mismos de siempre no a las mafias 
1,florcisparedes mashirafael razones para decir nono a la consulta mañosano a los mismos de siempre 
1,jpjaramillo lenin cpccs razones para decir nono a la consulta mañosano a los mismos de siempre n 
1,sincerebror razones para decir nono a la consulta mañosano a los mismos de siempre no a las mafias 
1,fernand hemos perdido un medio público ya no hay razón para leer el telégrafo la dictadura de moreno aca 
0,corre que te den a ti la vicepresidencia traidor dinero electronico dado a labanca sucia refineria del pacifico 
1,larocae lenin jorgeglas para mí puede ser un desacierto la suya pero la respeto quien metió preso a glas fu 
1,nunca en mi vida he dicho veces si esta vez con voz firme y mano dura diré si a la consulta vecessi 
1,paobasantes mcarvajala lenin tienes toda la razón ahora la senain anda haciendo todo menos lo q debe
0,estebanavila ese es el pensar y actuar de los lideres del gobierno anterior y parece q les contagio a algunitos 
0,luismongee mashirafael rcmguayas ecuadorrc somosmasec crcciudadanos falvaradoe eltelegrafo sofiaespin 
0,lassoguillermo el pueblo no podemos permitir la traicin y la ingratitudtodos a luchar por el no desde nuest 
1,albertoacostae no engañen con o sin consulta seguirán explotando las minas y el petróleo 
1,mashirafael el pueblo no podemos permitir la traicin y la ingratitudtodos a luchar por el no desde nuestras 
0,mashirafael si van a hacerle enojar a correa piensen en las consecuencias vecesno
1,vamosaldebate entre mashirafael y lenin para que porfin la gente se de cuenta que eñ gobierno les quiere ver la 
1,lenin moreno cuando el dicen vamosaldebate 
1,allannarvaez polyugarteg mvespinosas bernardonnsw lenin pepeav zebrarecalde seguro está haciendo campaña y 
1,davcaster mashirafael no puedo creer que haya gente que todavía piensa que fue un buen presidente
0,también recalcar que todo programa de gobierno es absolutamente gratis creamoscomunidad 
1,losseguidoresfalsosdelenin lenin cuanto le costaron esos seguidores para ver si yo me compro algunos y llego a los 
1,yakuana mashirafael mashirafael preguntele a ppsesa su ex ministro y los mas de invesrigaciones fiscales 
1,traducción después de la consulta moreno no me sirve más así q haré lo posible para desestabiliza al país o lo q 
0,somosmasec falvaradoe ja ja será que asiste al debate pero el líder de la banda de delincuentes que es correa o puro bla bla bla
1,animegalarza mashirafael janethinostroza y pregunten a patiño de donde compro la casa en la isla mocoli y la cas 
1,nadie sabe lo que tiene hasta que lo pierde y yo soy alguien muy preciado no por nada me llamo lenin javier quiñonez preciado
1,pipo lenin yo no vote por lenin como seguramente usted por borrega lo hizo no penso solo actuo y voto por 
0,lindabeautyh egperalta lassoguillermo lastimosamente esas reformas legales ni decretos no se dieron en la asamb 
1,mashirafael está bien mashi
0,chauvindiplo la vuelta a francia y al mundo por la igualdad de género una iniciativa del gobierno francés y las 
0,chauvindiplo la vuelta a francia y al mundo por la igualdad de género una iniciativa del gobierno francés y la 
0,lenin es conscuencia de la impunidad ante la corrupción como es posible que se permita a un ciudadano que todos s 
0,chauvindiplo la vuelta a francia y al mundo por la igualdad de género una iniciativa del gobierno francés y la 
1,quinhos marthisima mashirafael no hay nada que denunciar lo hecho con su casa fue legal pero absolutamente 
0,marcelaholguin puro show otro s al delincuente de correa deberían meterlo preso
1,guillaumelong mashirafael lenin seguramente alguna llamada de maduro porquele debe preocupar que si esto le hac 
1,santiagolodice gengis edgararauz mashirafael jamás en la historia de mi país un presidente ha dejado el car 
0,porque para variar nos quieren ver la cara de pendejos baca a correa lo va a dejar escapar eso lo sabemos la 
1,ecuador a decirle no al reparto de la patriasin ganar la consulta ya se han repartido pas ganando el s volve 
0,y porque no abrió una indagación previa cuando correa y sus matones rompieron la puerta e ingresaron a la humilde v 
0,la única verdad es la realidad la casa modesta de correa paga más impuestos que la mansión de rodas todo no 
1,mashirafael da gracias q el pana hizo su trabajo y por eso no te lincharon 
1,mashirafael la pregunta es solamente el interés particular de un dictador q pretende perennizarse en el poder p 
1,nelysuarezz mashirafael el expresidente puso dólares en la compra d su casa para evadir impuestos así d sim 
1,si y vecessi en la consulta popular 
1,evoespueblo mashirafael gobierna tu país
1,mashirafael sr correa es lo que usted provocó en sus años de victoria no veo a nadie haciendo vandalismo 
1,mashirafael no a las ratas nadie las protege ni las llevan en carros blindados tu te vas como un tipejo sinverg 
0,jarbus sebassal camilin eso no van a entender ni comprender para ellos correa nos construyó el estadio le 
1,marcoporchile mashirafael entre ratas se solidarizan
0,confirmado un show completo lo que sucedió en quininde por parte de correa en horas más detalles atentos 
1,marcooquendo joannajativa lenin ecuadorporlenin pameaguirre dantelo mashijuancarlos danielnovasco bucar 
0,hablar de corrupción cuando siempre la han tenido en casa cuando han sido criados por ella habla de esa falta de criterio y vergenza
1,mashirafael y en la foto la ilegítima y para colmo fea vicepresidenta cuántica chateando la muy sinvergenza 
1,juanmdold acá uno hizo jugar trece minutos adicionales y no lo terminó hasta asegurarse que el otro equipo ganara el inefable byron moreno
0,un no rotundo contundente aplastante definitivo absoluto un no lapidario para el gusano traidor 
1,mashirafael sr haga el favor de desaparecer del país no tiene sangre en la cara que no reconoce la debacle en q 
1,mashirafael tiene razón su amigo el fiscal le hace el jueguito pero más temprano que tarde irá tras las rejas 
0,alfuturodilesí con tu voto en paz y amor a la patria 
0,usted votará que sí porque tiene confianza en los cambios que propone la consulta o por puro odio al hdp de correa
0,mercurioec la vicepresidenta m alejandra vicuña intervino a nombre del gobierno en la inauguración de los comic 
1,gabrielaespais cnegobec oeaoficial nueva rica como usted que ahora come mierda vecessi
1,mashicampoelias mashirafael ecuadorrc el fotografía solo falta el cuántico
1,a las horas se reúne gabinete ampliado en presidenciaec para recibir resultados de consultapopular junto a lenin fmdistrito
1,mercurioec ecuatorianos en los recintos electorales de suecia y valencia españa luego de sufragar en la consulta 
1,como votaría ppsesa sabiendo q mashirafael lo sacó del anonimato y lo hizo uno de los hombres más importantes de 
1,martinminguchi todos los correistas que están gobernando con moreno son cómplices de la corrupcin todos sabían 
0,felipnajera sueñas con correa pana sano consejo hazte ver de un psiquiatra jajaja
1,fmmundo lenin a quién carajo le importa 
1,siilvialaverde mashirafael florcisparedes guerrerosdrcs pablojijon pilarromeroe pablorodrgueza tcanarte 
1,eluniversocom belenza que comico como mira a lenin el joven que esta en la mesa electoral y usa lentes
1,mercurioec tras sufragar en el recinto de la ute en quito el presidente lenin en declaraciones a la prensa dijo 
1,mashirafael pinocho deje de mentir
0,gracias mashi rafael hasta la victoria siempre 
0,aguschmer seguro no le apoyará a su amigo rafael
1,mashirafael muy de acuerdo por salud mental ya no hay que consumir productos de ñoslibres e independientes públicos y privados
1,pais lenin de que agradecimiento hablan ya basta de manipulaciones
1,punxivan mashirafael el banquero no ganó 
1,después de cumplir con mi voto consulta hornado de 
1,mashirafael no se dan cuenta que en la década ganada se robaron dos veces lo que en el feriado bancario
1,mashirafael caida se repite la historia karma le llaman
1,lenin cnegobec qué pasó con el sitio web para ver los resultados consultamañosa
1,cuidado lenin 
1,mashirafael jajajajaja feo ha sido no jajajajaja
0,nivel sinverguenza de este pillo 
1,mashirafael yo creo que puedes hacer plantón en el cne a ver que tal te va péndejo
1,mashirafael váyase a destejar en europa ahí es un humilde desconocido
1,desde hace una hora estoy comentando los resultados de la consulta popular de ecuador con fherrerarauz en 
1,lenin ecuador entero pide unidad y trabajo y esas serán nuestras prioridades la victoria del sí nos abre camino 
0,lenin el futuro no se detiene seguiremos trabajando por ustedes este es el gobierno de todos
1,presidente lenin dice no volverán los viejos políticos esta frase debe retumbar entre los simpatizantes de corr 
1,mashirafael yo solo vine a ver las puteadas 
1,lenin bueno bueno a partir de mañana a pagar las deudas a la derecha obvio a costa nuestra
1,possosports mashirafael plata botada ese título y luego se quejan de la violencia en los estadios q ustedes mism 
1,mashirafael gracias por hacer fraude jajajajajajajaja chao no ve 
0,felipnajera rahmreal deje de sufrir vaya duerma le hace falta felipillo pillo canguilillo
0,ese esta de acuerdo que violen niños y que un corrupto pueda volver a gobernarnos logros de la revolución ciud 
1,por qué reclaman a manabi si ellos aportaron a que gane lenin y por ende que haya esta consultarespect
1,mashirafael calla cadáver 
1,lenin señor presidente ganó el si por qué el pueblo así lo decidió por lo tanto inmediatamente ud debe cambiar su 
1,lenin informa que una vez recibido resultados de consultapopular se publicará en registrooficial para que en 
1,desorientadodt doralaopinadora higuerahernan ahora se ha dado por llamar periodista a cualquier pendejadalenin moreno
